{
    "$schema": "http://json-schema.org/draft-07/schema#",
    "$id": "https://schemas.com/processing/processing",
    "title": "import_movies",
    "description": "JSON Schema for electron microscopy processing",
    "type": "object",
    "properties": {
        "Import_movies": {
            "$ref": "import_movies.json"
        },
        "Movie_alignment": {
            "$ref": "movie_alignment.json"
        },
        "Movie_maxshift": {
            "$ref": "movie_maxshift.json"
        },
        "CTF_estimation": {
            "$ref": "CTF_estimation.json"
        },
        "Particle_picking": {
            "$ref": "particle_picking.json"
        },
        "Classes_2D": {
            "$ref": "classes2D.json"
        },
        "Initial_volume": {
            "$ref": "initial_volume.json"
        },
        "Classes_3D": {
            "$ref": "classes3D.json"
        }
    },
    "additionalProperties": false
}